name,scope,focus_area,audience,partnership_notes,status,last_reviewed
"Fulbright Foundation Greece","National (U.S.-study focus)","Scholarships; advising","Greek graduates; counselors","Co-host EducationUSA webinars; tap counselor network; highlight EU alternatives","Not contacted","2025-12-20"
"State Scholarships Foundation (IKY)","National","State/EU scholarships; Erasmus+ mobility","Greek students; researchers; educators","Align on recognition; propose co-funded scholarships in STEM/health; host Erasmus+ intensives","Not contacted","2025-12-20"
"Stavros Niarchos Foundation (SNF)","Global with Athens base","Philanthropic scholarships; fellowships","Greek/international students in SNF partner programs","Pitch co-funded seats in public health/data/arts; invite for summer schools","Not contacted","2025-12-20"
"Onassis Foundation","National applicants; global placements","Postgraduate scholarships; cultural exchange","Greek postgraduates; artists; researchers","Align priorities; propose scholarships tied to UNIC Athens; guest lectures/residencies","Not contacted","2025-12-20"
"Bodossaki Foundation","National (STEM emphasis)","Postgraduate scholarships; NGO leadership","Greek STEM/health graduates; NGO Academy alumni","Position UNIC STEM/health programs; short courses for NGO network","Not contacted","2025-12-20"
